ngram,freq
un po ' di,1333922
di cui al comma,842209
per la prima volta,831919
nel caso in cui,604974
dal punto di vista,581076
"convertito , con modificazioni",501753
nel momento in cui,417845
a che fare con,358328
di entrata in vigore,337223
a un certo punto,332461
data di entrata in,325877
il modo in cui,321816
"con modificazioni , nella",319654
si tratta di un,316787
la prima volta che,297369
un po ' più,295049
di tanto in tanto,284039
si tratta di una,267217
è in grado di,255162
fare a meno di,248930
del Presidente della Repubblica,245878
Questo comma è stato,236654
un vero e proprio,222391
decreto del Presidente della,222383
fino a quel momento,221615
una vera e propria,210965
po ' di tempo,208682
in un certo senso,204174
si rese conto che,204024
del codice di procedura,195130
anche in questo caso,193798
la maggior parte dei,190947
a poco a poco,190392
è stato così sostituito,189967
un punto di vista,189491
la maggior parte delle,184402
a meno che non,183583
è per questo che,183421
Questo articolo è stato,179823
mi ha detto che,178655
entrata in vigore della,176347
l' unica cosa che,174442
le disposizioni di cui,173535
entrata in vigore del,169854
"con modificazioni , dalla",167348
fino a quando non,165735
a dire il vero,165508
di cui al presente,165312
da un punto di,163160
il datore di lavoro,158950
nei casi in cui,153291
alla data di entrata,153108
nella parte in cui,150916
sono in grado di,150172
di volta in volta,146697
sono state così sostituite,146410
per tutta la vita,145199
caso in cui il,144658
per quanto riguarda la,144107
con la conseguenza che,143615
una cosa del genere,142841
di cui agli articoli,142659
il giorno in cui,141401
codice di procedura civile,140389
il motivo per cui,138997
al di là di,137938
nella misura in cui,135139
di cui ai commi,134778
codice di procedura penale,134248
un po ' troppo,133930
al di là del,133898
di cui al decreto,132600
state così sostituite dalle,130233
del datore di lavoro,129225
in tutto il mondo,128400
non si tratta di,127180
si applicano le disposizioni,126887
al di là della,126695
di cui agli artt,125371
essere in grado di,124975
un po ' come,124725
per il fatto che,124388
"modificazioni , dalla legge",124296
che si tratti di,121337
per la maggior parte,120759
tutto o in parte,119707
si strinse nelle spalle,119238
l' ultima volta che,118968
in tutto o in,117827
era la prima volta,116067
ai sensi del comma,114718
si alzò in piedi,114307
era in grado di,113368
nel corso degli anni,113189
dalla data di entrata,113171
il momento in cui,113148
"il Mulino , Bologna",112033
dal momento in cui,110676
per tutto il tempo,110615
se si tratta di,110058
è punito con la,109640
con decreto del Ministro,109294
si trattava di un,109225
nella maggior parte dei,108928
per quanto riguarda il,108887
gli occhi al cielo,107787
che si tratta di,106511
del decreto del Presidente,105713
in vigore del presente,104444
un paio di volte,104157
nel territorio dello Stato,103634
del rapporto di lavoro,102341
in tutta la sua,101347
comma è stato così,101202
la prima volta in,98960
da parte di un,98855
non si era mai,98568
il fatto è che,97117
questo punto di vista,96312
tutte le volte che,96190
se non fosse stato,95888
a che vedere con,95401
la maggior parte degli,95201
e si mise a,95190
quello che è successo,94983
"e , in particolare",94861
al momento in cui,94647
in fin dei conti,94598
di lì a poco,94572
maggior parte dei casi,93627
in entrambi i casi,93477
un po ' in,92875
caso in cui la,92463
disposizioni di cui al,92223
un po ' a,92204
così sostituite dalle attuali,92072
un po ' d',92002
di una serie di,91865
in uno stato di,91109
che si trattava di,90636
dopo la morte di,90284
di cui al primo,90199
fare in modo che,89904
in camera di consiglio,89873
la prima cosa che,89637
al di là delle,89413
a tutti gli effetti,88397
in vigore della legge,88285
si rese conto di,88103
giorni dalla data di,88001
del Consiglio dei Ministri,87981
si trattava di una,87592
punito con la reclusione,87579
nel caso di specie,87321
una volta per tutte,87298
se è vero che,86934
"be ' , non",86747
il fatto che il,86567
il fatto che la,86557
si può dire che,86338
che non aveva mai,86311
da questo punto di,85515
di fronte a un,85229
la maggior parte di,84904
a tutti i costi,84732
un paio di giorni,84617
Presidente del Consiglio dei,83823
il più delle volte,83660
tra le sue braccia,83527
di concerto con il,83511
vigore del presente decreto,83422
quando si tratta di,83142
in vigore della presente,82983
un po ' per,82493
tutto ciò che è,81311
disposizioni in materia di,81243
con la reclusione da,80831
con un filo di,80560
momento in cui si,80440
più di una volta,80164
in una sorta di,79980
entro il termine di,79663
a portata di mano,79584
è la prima volta,79533
chiuse gli occhi e,79386
di cui alla lettera,79376
al di fuori di,78534
e un paio di,78465
un quarto d' ora,78001
un certo numero di,77660
e se ne andò,77351
non l' ho mai,77104
per quanto riguarda le,76899
momento in cui il,76686
di tutto ciò che,76576
mi resi conto che,76209
al di fuori del,75869
non è altro che,75760
"e , di conseguenza",75453
una mano sulla spalla,75380
mi rendo conto che,75206
ha dichiarato l' illegittimità,74789
la verità è che,74670
con l' aiuto di,74649
in un primo momento,74401
il risarcimento del danno,74266
l' esistenza di un,74187
mano a mano che,74133
caso in cui l',74026
proprio in quel momento,73976
un po ' la,73759
la presenza di un,73512
signori azionisti sono convocati,73293
i casi in cui,73249
fino a che non,73173
mutuo per l' integrazione,73042
per il resto della,72857
"no , non è",72729
a mano a mano,72357
un gran numero di,72080
dichiarato l' illegittimità costituzionale,71698
vigore della presente legge,71583
un filo di voce,71094
cui al presente articolo,70997
come si è visto,70821
le lacrime agli occhi,70364
bel po ' di,70108
stato in grado di,69856
concerto con il Ministro,69481
in modo tale da,69399
punto di vista della,69255
non fosse stato per,69114
per quanto riguarda l',68843
che fare con la,68783
sia in grado di,68757
articolo è stato così,68627
in tutti i casi,68363
che in quel momento,68260
in base al quale,68247
in un modo o,68070
un sospiro di sollievo,68048
in punta di piedi,67986
per quanto riguarda i,67976
in linea di principio,67760
del Consiglio dei ministri,67692
non è in grado,67639
un paio d' ore,67479
come si è detto,67312
e si diresse verso,67312
e allo stesso tempo,67307
di ciò che è,67114
cui al decreto legislativo,67017
che a sua volta,66917
azionisti sono convocati in,66539
i suoi occhi si,66373
non vedo l' ora,66182
di fronte a una,66115
che la maggior parte,65811
la maggior parte del,65790
non si è mai,65727
"lo so , ma",65680
al di fuori della,65540
di tutto il mondo,65500
poté fare a meno,65499
in modo che il,65471
la sua voce era,65287
momento in cui la,65152
l' un l' altro,65112
di tutti gli altri,65021
"che , una volta",64805
di fronte a lui,64740
dal giorno in cui,64739
uno dopo l' altro,64662
in presenza di un,64613
delle imposte sui redditi,64592
"in particolare , la",64536
tutta una serie di,64416
del testo unico delle,64322
e al tempo stesso,64063
ha a che fare,64027
che non può essere,63712
a mo ' di,63602
"Corte costituzionale , con",63484
in camera da letto,63120
l' ultima cosa che,63064
al piano di sopra,63051
il suo modo di,62998
in cui si è,62988
alla fine degli anni,62889
ma in quel momento,62889
L ' Antico Testamento,62741
di un uomo che,62688
la porta si aprì,62555
di tornare a casa,62426
giorno successivo a quello,62301
di un paio di,62287
cui al primo comma,62064
l' unico modo per,61817
d' ora in poi,61609
un cenno del capo,61606
I signori azionisti sono,61443
nel giro di pochi,61355
fino a che punto,61340
il punto di vista,60864
Tutti i Diritti Riservati,60852
da parte del giudice,60831
non aveva mai visto,60706
in tutti i modi,60700
per la seconda volta,60645
"ad esempio , la",60605
e delle politiche sociali,60594
duplicazione del presente ebook,60522
in modo tale che,60475
parte in cui non,60429
qualsiasi duplicazione del presente,60401
Vietata qualsiasi duplicazione del,60337
che non si può,60336
come se fosse un,60121
per un paio di,59983
in presenza di una,59947
con il nome di,59767
te l' ho detto,59705
alla ricerca di un,59682
non poté fare a,59674
in una specie di,59457
"in particolare , il",59450
la maggior parte della,59419
pagamento di una somma,59244
"DEGLI ESTERI , SONNINO",59222
in questo caso il,59198
da una serie di,58990
che prima o poi,58983
le disposizioni del presente,58885
comma è stato aggiunto,58844
nel registro delle imprese,58841
al risarcimento del danno,58803
quello che era successo,58802
il fatto che non,58684
senza dire una parola,58528
ad un certo punto,58496
e a quel punto,58351
in questo caso la,58157
di cui si è,58040
è il caso di,58022
e tutto il resto,57973
per l' ultima volta,57964
si voltò verso di,57827
"costituzionale , con sentenza",57764
non ho intenzione di,57687
del Presidente del Consiglio,57518
"ad esempio , il",57385
e in quel momento,57327
la prima volta da,57311
con tutte le sue,57119
un po ' meno,56788
del luogo in cui,56763
un po ' il,56693
con decreto del Presidente,56615
cui al decreto del,56505
si diresse verso la,56496
di tutti i giorni,56477
ai sensi degli articoli,56389
in modo che la,56363
e non può essere,56317
sulla base di un,56212
articolo è stato inserito,56045
fare i conti con,55990
non era mai stato,55944
per un periodo di,55922
per l' ennesima volta,55889
arrivato il momento di,55870
un po ' e,55752
il caso in cui,55717
non ce la faccio,55567
tutta la sua vita,55500
il luogo in cui,55435
non è mai stato,55399
del Consiglio di Stato,55391
a destra e a,55310
da una parte e,55168
per tutta la notte,55071
ed è per questo,54773
in modo che non,54745
ai sensi degli artt,54523
non si sarebbe mai,54513
"che , per quanto",54463
tali disposizioni si applicano,54397
con l' obiettivo di,54358
di un sistema di,54149
anche nel caso in,53890
non vedeva l' ora,53803
in bianco e nero,53742
al di sopra di,53701
di uno o più,53637
che non avrebbe mai,53636
entro trenta giorni dalla,53606
o qualcosa del genere,53553
e i suoi occhi,53514
il problema è che,53427
in cui si trova,53346
niente a che fare,53312
vigore della legge di,53214
della legge di conversione,53211
del lavoro e delle,53034
sulla base di una,52876
"che , se non",52845
di un gruppo di,52840
si passò una mano,52776
in modo da poter,52744
pubblicazione nella Gazzetta Ufficiale,52663
nel modo in cui,52645
vale la pena di,52621
con lo scopo di,52536
la Banca d' Italia,52519
in una serie di,52518
di fronte a me,52437
successivo a quello della,52393
la Corte di Cassazione,52119
al di sopra della,52033
Gazzetta Ufficiale Serie gen,51992
avuto il coraggio di,51957
po ' di più,51859
nei confronti di un,51839
autonome di Trento e,51755
i suoi occhi erano,51743
in cui si trovava,51718
in tutte le sue,51633
che non riusciva a,51547
in un modo che,51406
comma è stato inserito,51402
da tutte le parti,51237
tutto il tempo che,51059
in cui si era,51054
province autonome di Trento,51021
al di là dei,50929
non l' aveva mai,50917
avere a che fare,50826
come tutti gli altri,50784
che si trattasse di,50678
per tutto il giorno,50647
un momento in cui,50584
l' entrata in vigore,50544
dal modo in cui,50528
in modo da non,50414
come una sorta di,50403
più in grado di,50360
z i o n,50311
non è un caso,50294
è stata così sostituita,50124
giunto il momento di,50038
per tutta la durata,49956
se da un lato,49952
a causa di un,49790
la porta alle spalle,49645
la sua capacità di,49478
legge di conversione del,49302
e nello stesso tempo,49253
con l' intenzione di,49135
se non ci fosse,49121
delle disposizioni di cui,49082
dalla testa ai piedi,49065
la cosa più importante,49049
ma allo stesso tempo,49041
punto di vista del,49033
prima di andare a,49004
non è detto che,48970
lavoro e delle politiche,48967
"che , in caso",48836
la luce del sole,48821
poco più di un,48762
con un paio di,48732
cui al presente comma,48723
e il fatto che,48689
al decreto del Presidente,48590
di fronte a lei,48565
l' esistenza di una,48483
tutte le cose che,48344
casi in cui il,48327
società a responsabilità limitata,48318
in quel momento non,48253
non ho mai visto,48157
il punto di partenza,48127
di beni e servizi,48046
in grado di fare,48027
ai fini della determinazione,48025
a differenza di quanto,47964
casi in cui la,47945
con un cenno del,47919
la ragione per cui,47885
i o n e,47845
il senso di colpa,47804
non ho bisogno di,47719
la prima volta nella,47647
"di lui , e",47601
a tutti gli altri,47572
"che , nel caso",47464
scosse la testa e,47408
non aveva idea di,47374
avuto il tempo di,47277
si schiarì la voce,47156
nulla a che fare,47136
su e giù per,47134
non si trattava di,47119
come nel caso di,47109
fece un passo indietro,46959
e le modalità di,46902
"per esempio , il",46711
"sì , ma non",46552
della Corte di Cassazione,46487
non era mai stata,46486
"per esempio , la",46458
Università degli Studi di,46420
di cui alla legge,46420
come si fa a,46364
mi viene in mente,46265
al datore di lavoro,46232
non mi sono mai,46211
e per di più,46135
sotto il profilo della,46045
nel punto in cui,46036
che in qualche modo,46032
"e , anche se",46030
con entrambe le mani,46029
modo in cui si,45956
di ogni altra cosa,45943
europeo e del Consiglio,45935
alzò gli occhi al,45863
per i quali è,45782
la presenza di una,45752
si mise a sedere,45708
per la realizzazione di,45704
tutto e per tutto,45668
mi ha chiesto di,45635
sentenza di primo grado,45567
più di ogni altra,45465
norme in materia di,45442
delle infrastrutture e dei,45433
dal momento che la,45413
maggior parte delle persone,45403
di tutte le cose,45381
tribunale per i minorenni,45335
anche in caso di,45010
in cerca di un,44935
per il fatto di,44831
come se si fosse,44753
non sono in grado,44737
al fine di evitare,44728
l ' idea di,44713
qua e di là,44656
come se fosse una,44648
nel corso del tempo,44614
di qua e di,44469
in tutto e per,44414
infrastrutture e dei trasporti,44290
vedo l' ora di,44285
qualcosa che non va,44232
vedeva l' ora di,44210
tra le braccia di,44181
dal datore di lavoro,44163
"comma , del codice",44153
del Parlamento europeo e,44130
ha il diritto di,44118
a pena di decadenza,44081
che cosa è successo,44040
si alzò e si,44004
da capo a piedi,43957
a partire dagli anni,43952
non aveva bisogno di,43903
le modalità di cui,43845
gli occhi e si,43827
in questo caso si,43707
al fine di garantire,43607
che non ci sia,43537
ogni volta che si,43432
non ha bisogno di,43427
Questo periodo è stato,43415
si tratti di un,43394
il modo migliore per,43260
del giudice di pace,43256
"in particolare , l'",43225
momento in cui l',43159
e in ogni caso,43158
a causa di una,43138
mi ha detto di,43133
stata in grado di,43116
che fare con il,43100
non aveva intenzione di,43029
"che , per la",42985
a una serie di,42952
non ho mai avuto,42842
non è il caso,42793
da quel momento in,42790
destra e a sinistra,42697
in giro per il,42637
non riusciva a capire,42623
non si sa mai,42460
la disposizione di cui,42431
mesi dalla data di,42427
lo stesso vale per,42410
un sacco di cose,42311
Presidenza del Consiglio dei,42295
al di sopra del,42209
di lavoro a tempo,42188
la porta d' ingresso,42145
un bicchiere di vino,42054
tutte le sue forze,41980
con tutto il cuore,41956
il punto in cui,41923
e tutto ciò che,41888
l' impressione di essere,41839
non era in grado,41784
il suo sguardo si,41713
a pena di nullità,41656
che non ho mai,41639
di Trento e di,41626
in via di sviluppo,41564
in caso di mancata,41542
in quel momento si,41521
con una serie di,41418
con l' intento di,41402
di cui al precedente,41381
le mani sui fianchi,41355
un foglio di carta,41325
Trento e di Bolzano,41269
nel cuore della notte,41259
la sensazione di essere,41215
come se non fosse,41209
non aveva mai avuto,41206
un po ' con,41180
verso la fine del,41136
si mise a ridere,41131
le prese la mano,41129
questione di legittimità costituzionale,41048
dal trentesimo giorno successivo,40968
Parlamento europeo e del,40873
mi hanno detto che,40853
un paio di minuti,40780
con la sanzione amministrativa,40644
in ogni caso non,40598
un uomo che non,40592
mano tra i capelli,40586
tra sé e sé,40572
secondo quanto previsto dalla,40492
al piano di sotto,40483
e chiuse gli occhi,40472
e per un attimo,40456
lo sguardo su di,40447
tutta la mia vita,40427
Questa lettera è stata,40406
si applica l' articolo,40350
per le indagini preliminari,40342
per la produzione di,40321
anche nel caso di,40303
dal momento che il,40293
le braccia al collo,40273
ai sensi del presente,40249
un paio di settimane,40249
del lavoro e della,40248
di tutto quello che,40096
istituto mutuante ad effettuare,40038
una tazza di tè,40023
fare l' amore con,39958
"e , più in",39936
articolo è stato abrogato,39925
in una situazione di,39863
disponibile anche in e,39831
esercizio del diritto di,39794
una cosa che non,39784
tra le braccia e,39784
"che , anche se",39767
"di me , e",39752
ha detto che non,39719
su per le scale,39714
anche se non è,39672
dal momento che non,39631
tra le mani e,39591
in tal caso il,39571
illegittimità costituzionale di questo,39549
"e , dopo aver",39472
di cui alle lettere,39464
più di un anno,39453
si veda l' art,39447
del decreto legislativo n,39428
gli ho detto che,39412
una ciocca di capelli,39402
somministrazione dei due terzi,39370
con i suoi occhi,39332
del fatto che la,39318
l' illegittimità costituzionale di,39290
se il fatto è,39243
in linea di massima,39218
mutuante ad effettuare la,39211
il fatto è commesso,39143
non può che essere,39017
al di sotto del,39015
nel corso di un,39005
il che significa che,39001
l ' obbligo di,38999
verso di me e,38995
a dire la verità,38991
al di fuori dei,38975
alla luce del sole,38933
un po ' che,38931
una frazione di secondo,38913
si tratta solo di,38886
protezione dei dati personali,38860
il fatto di essere,38832
stesso modo in cui,38805
in cui è stata,38800
e tutti gli altri,38798
che non si era,38789
di indiziato di delitto,38766
momento stesso in cui,38747
del mercato del lavoro,38697
del pagamento di una,38690
della Banca d' Italia,38660
il passare del tempo,38659
non si può dire,38658
come se fosse stato,38632
a tutto ciò che,38620
d e l l,38593
una tazza di caffè,38590
si trattasse di un,38490
"mutuo stesso , a",38485
una mano tra i,38472
da un lato e,38395
la punta delle dita,38371
la vita e la,38348
in mezzo alla strada,38198
che fino a quel,38176
non ci sono più,38143
una dopo l' altra,38121
non era riuscito a,38101
quel momento in poi,38085
di cui al secondo,38067
a quello in cui,38022
modo in cui la,38010
"o , in mancanza",38000
per quanto concerne la,37926
del fatto che il,37878
il Consiglio di Stato,37839
luogo in cui si,37742
a quello della sua,37708
per un braccio e,37657
trentesimo giorno successivo a,37654
"in realtà , non",37653
non so che cosa,37652
come se non bastasse,37612
per quel che riguarda,37594
verso di lui e,37586
dopo la sua morte,37552
le mani in tasca,37544
in un momento di,37501
"No , non lo",37484
in quel momento che,37470
un bicchiere d' acqua,37462
e scosse la testa,37460
in questo modo si,37456
ho l' impressione che,37396
in carne e ossa,37338
del consiglio di amministrazione,37291
con la quale si,37199
un paio di jeans,37199
sua pubblicazione nella Gazzetta,37161
il tempo in cui,37051
la testa tra le,37021
di vita e di,37016
per un certo periodo,37001
è una cosa che,36998
a tal punto che,36985
di cui non si,36968
una parte di me,36931
in un certo modo,36875
della Corte dei conti,36855
alla ricerca di una,36810
in cui è stato,36770
si rende conto che,36739
un sacco di tempo,36715
"di lei , e",36655
si schiarì la gola,36647
punto di vista di,36597
siamo in grado di,36590
quando si parla di,36560
milioni di euro per,36520
non ci si può,36510
"Sì , lo so",36436
da un gruppo di,36413
in base alla quale,36408
Fermo di indiziato di,36387
che non ha mai,36361
il viso tra le,36347
i datori di lavoro,36306
non è questo il,36258
al di fuori delle,36200
che in caso di,36198
in un primo tempo,36192
al giorno d' oggi,36182
a un paio di,36174
interamente versato Tribunale di,36161
applicano le disposizioni di,36126
può fare a meno,36125
"di lui , ma",36120
si voltò di scatto,36111
una somma di denaro,36083
di non riuscire a,36075
il fatto che l',36052
"e , una volta",36012
Ministero del lavoro e,35995
d ' altra parte,35988
in questo caso è,35987
della Corte di cassazione,35948
di una somma da,35937
nel bel mezzo di,35935
della sua pubblicazione nella,35920
penalmente secondo quanto previsto,35895
di risarcimento del danno,35887
sanzionata civilmente e penalmente,35881
civilmente e penalmente secondo,35881
e penalmente secondo quanto,35880
sarà sanzionata civilmente e,35875
distribuzione o fruizione non,35871
o fruizione non autorizzata,35867
Qualsiasi distribuzione o fruizione,35852
e sarà sanzionata civilmente,35851
era il caso di,35839
del modo in cui,35815
di una sorta di,35813
ha l' obbligo di,35809
con le mani in,35792
non riesco a capire,35787
"che , in un",35740
viso tra le mani,35673
diverso da quello che,35649
"come , ad esempio",35637
e della tutela del,35633
testo unico delle leggi,35629
più di quanto non,35626
reclusione da uno a,35620
olio extravergine di oliva,35581
ancora una volta la,35579
si appoggiò allo schienale,35509
il cuore in gola,35506
fosse in grado di,35456
caso in cui si,35454
per quanto mi riguarda,35439
che non ci fosse,35426
"di scambio , commercio",35412
giudice per le indagini,35388
al giudice di pace,35346
non è necessario che,35343
della tutela del territorio,35326
per il solo fatto,35321
"è vero , ma",35311
su tutte le furie,35247
in preda al panico,35246
avuto la possibilità di,35213
quello della sua pubblicazione,35200
io non ho mai,35187
si morse il labbro,35141
"del Consiglio , del",35134
fino a quando il,35126
che non possono essere,35061
che non avevo mai,35056
sanzione amministrativa del pagamento,35049
alzò in piedi e,35047
di andare a letto,35038
nei casi di cui,35030
che non si sarebbe,35029
in possesso dei requisiti,35017
per un totale di,34964
m e n t,34963
in silenzio per un,34956
l ' esistenza di,34933
di posta elettronica certificata,34924
nel corso di una,34854
al punto in cui,34835
in contrasto con la,34826
amministrativa del pagamento di,34811
non avevo mai visto,34799
da parte di una,34786
non avrebbe mai potuto,34775
in corso alla data,34773
ti ho detto che,34753
ma non per questo,34714
nella seconda metà del,34696
testo unico delle disposizioni,34684
questo è il mio,34674
un punto di riferimento,34674
e la sua famiglia,34642
di uno Stato membro,34626
come se niente fosse,34618
di cui aveva bisogno,34605
giù per le scale,34598
in tutte le direzioni,34595
non mi ha mai,34574
"e , per quanto",34547
con il passare del,34540
faccia a faccia con,34511
in questo caso non,34457
"po ' , ma",34439
successivo a quello in,34412
per far sì che,34410
per la presenza di,34408
di quando in quando,34326
per un periodo non,34257
si diresse verso il,34133
la pena di morte,34131
la creazione di un,34120
di una o più,34081
di questo tipo di,34049
che non si è,34043
in ogni caso la,34032
di non aver mai,34008
meno che non si,34003
dopo un paio di,33983
sanzione amministrativa pecuniaria da,33959
in tutto il corpo,33957
nel giro di un,33877
un periodo di tempo,33858
è il momento di,33844
disposizioni di cui ai,33822
e con la multa,33816
la porta di casa,33808
Gazzetta Ufficiale della Repubblica,33778
Ministro del lavoro e,33777
ciò che è stato,33758
posso fare a meno,33747
tutte le persone che,33737
in un angolo della,33692
e per la prima,33675
a far parte della,33649
termine di trenta giorni,33645
con gli occhi chiusi,33590
con la multa da,33571
po ' d' acqua,33554
non è quello che,33523
da parte di chi,33515
non è un problema,33499
della patente di guida,33491
fece un respiro profondo,33477
"ti prego , non",33462
dal fatto che il,33457
dei datori di lavoro,33454
la possibilità di una,33397
a causa della sua,33357
di quello che è,33311
termine di cui al,33294
decreto del Presidente del,33273
come si è già,33264
un tono di voce,33260
non luogo a procedere,33239
da un paio di,33211
i soggetti di cui,33158
si alzò di scatto,33139
il maggior numero di,33134
della Corte di giustizia,33132
se si trattasse di,33107
con tutta la sua,33085
nel senso che la,33020
ma non riusciva a,33018
non è mai stata,32973
maggior parte del tempo,32948
disposizioni del presente articolo,32892
e la possibilità di,32858
in fretta e furia,32852
non era il caso,32840
di un contratto di,32798
ai sensi della legge,32796
era il momento di,32760
in quel momento la,32758
al modo in cui,32721
al fine di assicurare,32720
l' esercizio del diritto,32718
a decorrere dalla data,32712
Non ne ho idea,32623
la prima volta nel,32616
una decina di minuti,32605
al di sotto della,32558
giudizio di primo grado,32556
con una punta di,32516
la sanzione amministrativa pecuniaria,32500
si tratti di una,32469
del suo meglio per,32454
"Bollati Boringhieri , Torino",32422
a un gruppo di,32417
"che , ai sensi",32409
in un secondo momento,32408
si sporse in avanti,32408
fatto di tutto per,32362
parentesi quadrate sono state,32347
di tutte le altre,32340
"che , come si",32319
è il fatto che,32318
ancora una volta il,32304
è un caso che,32290
non posso fare a,32278
in cui non si,32265
da quella in cui,32263
interamente versato Iscritta al,32256
la possibilità di un,32246
