ngram,freq
I do not know,17575369
the end of the,16022205
in the United States,12792982
at the same time,11604349
at the end of,11175415
the rest of the,9700702
as well as the,9642833
did not want to,9248714
do not want to,8142892
On the other hand,7751333
I do not think,7744914
in the case of,7694264
I do not want,7460663
Series : Parallel Bible,7177313
in whole or in,6873472
as a result of,6855997
one of the most,6813500
for the first time,6783036
whole or in part,6744570
in the form of,6672904
in the middle of,6574511
May not be copied,6419857
I 'm going to,6403312
is one of the,6311907
"be copied , scanned",6301687
"or duplicated , in",6249353
Due to electronic rights,6248517
"duplicated , in whole",6216537
"scanned , or duplicated",6197460
or eChapter ( s,6189743
and / or eChapter,6172922
be suppressed from the,6156912
some third party content,6156606
may be suppressed from,6152940
content may be suppressed,6146367
party content may be,6118471
third party content may,6105827
of the United States,6035375
on the basis of,6028997
"rights , some third",6026474
eBook and / or,6023240
suppressed from the eBook,6009141
"electronic rights , some",5998301
from the eBook and,5979834
At the same time,5693295
the middle of the,5611604
on the other hand,5604906
in front of the,5558656
in the context of,5338216
to be able to,5248957
the top of the,5233527
"said , "" I",4884276
I did not know,4754647
do not know what,4519443
the edge of the,4514464
at the time of,4427270
can be used to,4401486
do not have to,4329663
the fact that the,4318343
the back of the,4305269
was one of the,4262626
"For example , the",4255580
the beginning of the,4177513
Parallel Bible Halseth English,3994121
In the case of,3941746
the other side of,3782402
the side of the,3779940
the nature of the,3698528
I did not want,3561438
not be able to,3549739
on the other side,3540863
the bottom of the,3534956
"New York , NY",3519042
Cambridge : Cambridge University,3504276
at the University of,3497274
in terms of the,3481741
in the presence of,3418082
for a long time,3412668
with respect to the,3298581
was not going to,3259824
at the beginning of,3234162
it is important to,3232585
a member of the,3218753
in a way that,3195969
the name of the,3195603
in the first place,3139142
I do not have,3132692
on the part of,3118011
other side of the,3094255
"In addition , the",3030565
the so - called,3019085
Bible -- The Gospels,3010045
the center of the,3000545
the time of the,2999073
if you do not,2996509
as part of the,2981815
a great deal of,2974006
in the face of,2965582
a wide range of,2911971
the United States and,2882801
did not know what,2873611
the size of the,2860044
At the end of,2845960
at the top of,2822768
for the purpose of,2822716
in accordance with the,2806103
Oxford : Oxford University,2790645
it is possible to,2754331
that there is a,2743328
"for example , the",2723598
in the absence of,2707252
I 'm not sure,2681207
as well as a,2671384
in the midst of,2645807
I want you to,2630904
It is important to,2627885
in relation to the,2624075
the extent to which,2620873
a result of the,2617078
to the fact that,2601871
for the sake of,2593015
do not know how,2587757
was going to be,2576633
in the course of,2559628
I was going to,2548567
the use of the,2547748
to do with the,2530911
in the direction of,2528512
when it comes to,2523592
and I do not,2518317
can be found in,2514931
in front of him,2505008
is based on the,2504681
nothing to do with,2498522
I would like to,2489226
the value of the,2476146
the case of the,2474884
will be able to,2471757
as shown in Figure,2466353
for the rest of,2464931
he was going to,2464356
did not have to,2460360
in the same way,2448739
as a function of,2441515
a large number of,2430101
"For example , in",2428068
but I do not,2415002
in the name of,2401884
If you do not,2367100
you do not have,2348248
not want to be,2343559
the way in which,2322382
a part of the,2315468
I 'd like to,2287247
in front of her,2281817
the head of the,2269582
as one of the,2267423
"For example , if",2257067
What do you mean,2252536
on the one hand,2236550
the direction of the,2223790
the first time in,2215830
the course of the,2214288
"that is , the",2205074
in such a way,2193353
the ways in which,2180063
that there is no,2179538
do not need to,2172438
In addition to the,2170389
the role of the,2166349
in the process of,2157295
in one of the,2156675
the part of the,2153850
of one of the,2146314
the development of the,2133886
to go to the,2122280
to the United States,2116355
took a deep breath,2106841
"In fact , the",2100458
on the edge of,2098287
from time to time,2094679
University of Chicago Press,2089911
at the bottom of,2080730
"For example , a",2073269
the front of the,2071273
not know what to,2064375
are more likely to,2063031
you 're going to,2046436
the surface of the,2041928
the form of a,2034208
to get out of,2029520
but he did not,2025682
by the fact that,2011912
in the field of,2010393
did not seem to,2004923
the basis of the,2004476
as well as in,1993182
I did not have,1992348
turned out to be,1979983
it is necessary to,1977185
do not have a,1958745
New York : Oxford,1955628
that he did not,1940099
in the development of,1937793
"me , and I",1927285
What do you think,1921209
per cent of the,1911147
did not have a,1910555
the context of the,1896103
to take care of,1887061
I do not like,1874639
York : Oxford University,1872624
the power of the,1871222
the history of the,1834694
of the twentieth century,1834004
not know how to,1820298
One of the most,1818047
the two of them,1816987
you do not want,1803804
by the end of,1800948
of the fact that,1792972
"However , it is",1791626
in the history of,1791018
"other words , the",1783216
the length of the,1781382
"other hand , the",1773021
Why do not you,1772085
should be able to,1765910
on top of the,1765162
He shook his head,1762166
would be able to,1752345
the back of his,1746081
he did not want,1745283
She shook her head,1742485
but I did not,1740801
to the end of,1738447
in the way of,1737517
United States of America,1733385
of the world 's,1729585
for the most part,1729148
going to have to,1728917
in the hands of,1727144
could not help but,1716912
You do not have,1715339
at the expense of,1714478
to one of the,1713847
in and out of,1713481
of the most important,1703394
in the sense that,1700813
What are you doing,1700416
I do not believe,1697493
I do not care,1694742
I 'm not going,1687640
on the side of,1687004
out of the way,1685386
as well as to,1683401
the heart of the,1673593
in a variety of,1671766
"this case , the",1662715
University of California Press,1661770
she was going to,1653990
did not have the,1648324
Which of the following,1639033
John ( Basic English,1639005
be found in the,1634251
with the help of,1630017
and the United States,1613231
an important role in,1611758
the face of the,1608635
If you want to,1608473
in a number of,1599440
it is difficult to,1599039
would not have been,1596733
if you want to,1594273
you do not know,1591440
New York : Routledge,1589466
as part of a,1588335
that it would be,1588085
I do not see,1584818
On the one hand,1581379
to ensure that the,1580890
as a means of,1580077
the United States of,1579525
to the extent that,1579227
the presence of the,1577487
in the light of,1576585
do not think I,1574267
I did not think,1574024
I can not believe,1573312
does not mean that,1571329
For the first time,1569444
"him , and he",1569160
did not know how,1568826
on the back of,1565417
at the back of,1565188
at the age of,1562141
I do not understand,1560284
what was going on,1551609
he did not know,1546765
do not know if,1543121
I am going to,1541129
would have to be,1538251
that it is not,1535909
the case of a,1535273
in front of me,1530913
in the back of,1526359
as if it were,1523215
in addition to the,1518765
the base of the,1516694
to the development of,1513344
in an attempt to,1509125
at the heart of,1505064
to go back to,1502479
is going to be,1497330
"you , "" he",1497269
she did not want,1496263
it can not be,1492356
it is clear that,1489113
it would have been,1488964
Chicago : University of,1479091
that can not be,1477406
to look at the,1477344
and I did not,1475702
going to be a,1474646
on behalf of the,1474398
the relationship between the,1473511
is likely to be,1468331
have been able to,1467991
do not have the,1465705
"a result , the",1465227
as if they were,1464906
the quality of the,1461102
and colleagues published their,1460375
published their study in,1459954
colleagues published their study,1459754
that it was not,1448405
"said , "" You",1448078
a wide variety of,1447377
No part of this,1446382
in the center of,1443419
in a state of,1440209
By the end of,1436850
as soon as possible,1435477
not have to be,1430796
with the exception of,1430327
as a matter of,1428428
such a way that,1426503
that there was a,1424716
but she did not,1424033
as if he were,1423092
the importance of the,1420296
to be in the,1419811
not going to be,1419474
and at the same,1416176
the centre of the,1415491
of the nineteenth century,1412277
the hands of the,1411036
the presence of a,1408235
to deal with the,1407901
at the level of,1407715
to make sure that,1407666
As a result of,1406009
the Second World War,1404725
referred to as the,1404624
I think it 's,1403891
in the sense of,1403605
the start of the,1400039
are you going to,1388805
the level of the,1385857
that there was no,1381638
the way to the,1378142
all the way to,1377704
with regard to the,1376109
but it was not,1375800
that he was not,1373734
the fact that he,1373327
one of the first,1372400
the back of her,1370458
and the rest of,1366944
that I did not,1364775
John Wiley & Sons,1361638
the end of a,1356755
know what to do,1348414
the members of the,1348226
the work of the,1343126
I would not have,1336833
will not be able,1336315
we 're going to,1324191
should be noted that,1316684
out of the room,1316361
"the world , and",1316156
but I can not,1315965
in the number of,1311554
the total number of,1310493
of some of the,1310169
you want me to,1309509
it would not be,1307442
the difference between the,1302502
more likely to be,1301729
the meaning of the,1298950
the use of a,1298086
is part of the,1298022
the position of the,1297670
that you do not,1290886
a function of the,1284210
it would be a,1282368
"you , "" she",1279986
for the purposes of,1271682
a bit of a,1266771
"Inc. , Until December",1265662
the life of the,1265506
is shown in Figure,1264589
when it came to,1263741
in any form or,1263584
in the area of,1260970
the development of a,1259973
to get rid of,1258042
that can be used,1257224
may or may not,1256051
"same time , the",1254840
the long - term,1253241
as long as the,1252989
form or by any,1242020
any form or by,1240806
can be seen in,1240338
in an effort to,1238340
most of the time,1233142
that he could not,1232618
not been able to,1229749
I do not need,1225097
would not be able,1224964
for the development of,1223258
one of the best,1221660
the majority of the,1219800
did not need to,1216969
the structure of the,1216634
in the treatment of,1213772
she did not know,1213708
we do not have,1213003
and one of the,1210855
MA : Harvard University,1209530
the other end of,1209173
that I do not,1208639
What do you want,1207589
the same as the,1206621
But I do not,1206469
to the point of,1206458
in front of a,1205225
the results of the,1203223
for a few minutes,1203010
to the top of,1201110
is the same as,1198868
of a number of,1198392
up and down the,1196241
"to him , and",1195442
I was able to,1195282
has deemed that any,1193814
a copy of the,1193310
deemed that any suppressed,1192941
on either side of,1189199
over the course of,1189177
that is to say,1189072
that it was a,1189035
that she did not,1187278
to be found in,1187058
could not have been,1187026
at a time when,1183713
that any suppressed content,1182878
that he had been,1182871
any suppressed content does,1182751
some of the most,1182613
suppressed content does not,1182334
does not have to,1181918
do not know why,1181639
content does not materially,1180940
he did not have,1180564
was the first time,1179735
review has deemed that,1179184
both sides of the,1179160
the light of the,1178261
Editorial review has deemed,1177348
in spite of the,1176413
does not seem to,1176312
twenty - first century,1175020
as far as the,1171672
the best way to,1170930
at the edge of,1170618
and he did not,1167569
are a number of,1167076
I had no idea,1166551
be one of the,1162486
we do not know,1158349
"her , and she",1156024
to that of the,1155801
in the eyes of,1155782
"me , "" he",1153893
is an example of,1152989
in New York City,1152912
might be able to,1152714
He did not want,1151467
the second half of,1150745
in order to be,1150595
Copyright 2011 Cengage Learning,1148855
an increase in the,1148784
She did not want,1148427
the rest of his,1145163
I will not be,1143760
"this chapter , we",1142867
all over the world,1141280
the foot of the,1140004
I 'll tell you,1138946
page intentionally left blank,1135301
This page intentionally left,1133785
out of the car,1132482
a matter of fact,1131647
It was as if,1130348
are likely to be,1128029
or by any means,1127322
one of the few,1126505
but it is not,1126283
not seem to be,1125695
For more information on,1124081
the existence of a,1120899
and there was a,1119414
and there is no,1117354
be used as a,1117257
can be used for,1117051
may be able to,1116714
other end of the,1116560
in a position to,1114980
go back to the,1114307
Copyright 2012 Cengage Learning,1113982
the sum of the,1113431
I want to be,1111901
It should be noted,1111300
as if he had,1109430
in the Middle East,1109332
over and over again,1107560
what 's going on,1104824
was supposed to be,1103855
the same way as,1103360
reserves the right to,1102215
and the fact that,1101727
and the number of,1099592
with the rest of,1096918
the corner of the,1094936
has been shown to,1094717
it was time to,1091315
is important to note,1089258
for the benefit of,1088807
the creation of a,1088654
on one of the,1088602
The rest of the,1087969
I did not mean,1084769
I 've got to,1082533
Berkeley : University of,1080307
there would be no,1080289
did not say anything,1080227
as soon as the,1080127
from the fact that,1079974
to get to the,1079754
to take advantage of,1079750
in the event of,1079598
but I could not,1078796
seems to have been,1077298
the manner in which,1076290
in response to the,1074813
the fact that it,1074398
"said , ' I",1073330
the sound of the,1073009
"to me , and",1070070
but there was no,1069610
Do you want to,1068726
the twenty - first,1065762
for a couple of,1065030
and out of the,1064532
do you want to,1063437
the door of the,1063272
rest of the world,1063086
does not want to,1062320
the needs of the,1062195
at the head of,1060840
in the wake of,1060128
does not materially affect,1059607
I 'm sure you,1057008
not materially affect the,1054570
"additional information , contact",1054468
I was not sure,1054295
at the foot of,1053830
can be seen as,1053075
despite the fact that,1053035
materially affect the overall,1050893
affect the overall learning,1047471
the overall learning experience,1047124
the terms of the,1046842
I could not help,1045115
important to note that,1044948
the effect of the,1042636
You do not know,1039346
of the number of,1039095
to return to the,1037296
you are going to,1037073
as much as possible,1035722
the end of this,1035363
"See , for example",1034558
the only way to,1034494
I can not help,1033840
"Of course , the",1033667
do not have any,1032496
a deep breath and,1032459
"is , of course",1031792
from the perspective of,1031529
if he did not,1030409
the degree to which,1029423
is said to be,1029312
that one of the,1029166
the result of the,1029090
from the University of,1027656
as if she were,1027111
and I can not,1027091
for as long as,1026849
the state of the,1026468
The Gospels -- Matthew,1024480
other parts of the,1023950
an integral part of,1021730
for the treatment of,1021148
How do you know,1020834
the right to remove,1020542
Learning reserves the right,1020454
the vast majority of,1019715
Cengage Learning reserves the,1019500
the first half of,1019074
find a way to,1017284
for the use of,1016195
"the door , and",1015077
the location of the,1014887
He did not know,1014085
on the surface of,1014041
anything to do with,1013620
as a way of,1012243
and the use of,1011751
at the center of,1009858
the First World War,1007781
parts of the world,1007024
as soon as he,1006082
a lot of time,1005631
for each of the,1003760
as soon as I,1003252
to be one of,1002528
as a form of,1001884
"it , "" he",1001784
at the base of,1001753
and there was no,1000559
the impact of the,1000267
that it is a,1000251
to the use of,999600
at the start of,999544
I ' m not,998981
there has been a,998287
is the result of,997540
that they do not,997499
"for example , in",996255
the idea of a,996059
is the number of,995378
is due to the,995162
"In fact , it",995034
of the Holy Spirit,995003
I do not even,992703
as we have seen,991146
right to remove additional,990028
in charge of the,989877
in the United Kingdom,989593
the United States in,989466
John ( King James,989014
the right of the,988729
"he said , and",987885
the point of view,985355
out of the house,985250
"that , in the",985028
one side of the,984960
of the University of,984611
That 's what I,983680
the scope of the,983254
the eyes of the,983233
of the United Nations,982179
as in the case,981635
he was able to,980873
"example , in the",979733
get out of the,978867
do not think so,978291
is not going to,978281
"me , but I",977320
a long - term,977013
is referred to as,976793
a ) ( 1,975800
as shown in Fig,975225
"me , "" she",974710
at any time if,974434
had nothing to do,974106
be seen as a,973272
the form of the,972827
I do not remember,972472
one or more of,971722
the turn of the,971031
I 'm so sorry,971008
We 're going to,969146
second half of the,968194
a few of the,968094
through the use of,967419
the influence of the,965808
but it did not,965105
the end of his,961991
You 're going to,961982
something to do with,960884
in the long run,958198
I would not be,957847
the rest of us,957369
is that it is,956883
any time if subsequent,956255
time if subsequent rights,955874
NTIS ( U.S. Sales,955856
In : Proceedings of,954790
the date of the,954213
if subsequent rights restrictions,953990
it is impossible to,953895
"of course , but",953865
the fact that they,952925
it is not a,952806
Subd Geog ) UF,952043
do not want you,951960
but he could not,951686
to talk to you,950961
did not have any,950866
additional content at any,950457
rights restrictions require it,950382
in order to make,949895
remove additional content at,949374
to remove additional content,949293
I 've got a,949097
subsequent rights restrictions require,948871
"For instance , the",945539
content at any time,944556
does not have a,943735
in the living room,942795
to come up with,942085
as well as for,941392
I did not see,940813
point of view of,940565
is related to the,939937
had no idea what,939865
the creation of the,939717
that he had not,939447
the remainder of the,939117
not want to go,937891
to get back to,937244
the size of a,936286
it was not a,935551
and some of the,935057
the middle of a,934950
can be used as,934855
She did not know,933251
as if he was,932717
"each other , and",931918
At the time of,931658
Journal of the American,930880
I have no idea,929902
have the right to,926524
in the use of,924710
to the back of,923856
part of this book,923476
the absence of a,922069
"and , in the",922058
a good deal of,921273
the purpose of the,921107
to the number of,920855
the story of the,920626
that he was a,919539
It was not a,918115
as a way to,917443
"for example , a",917385
on the way to,914075
and it was not,914030
can be contacted at,912390
of his or her,911391
for a few days,910988
of the nature of,906766
to be part of,906618
the last of the,905589
of the relationship between,904856
I shook my head,904848
can also be used,903814
be obtained by contacting,903644
By a News Reporter,903125
Staff News Editor at,903105
and I could not,901912
the result of a,901817
not need to be,901567
more information on this,901242
to participate in the,900768
In the United States,899696
I 'll have to,898904
In the absence of,898836
to make sense of,898183
the effects of the,897673
the same time as,897587
to the rest of,897368
it was too late,895423
I 'm not a,894777
was the first to,894074
I can not tell,893148
she did not have,893061
the source of the,892604
we are going to,892130
no choice but to,891194
came out of the,890933
with a view to,890420
"In particular , the",890139
in connection with the,890017
or more of the,889565
can be used in,888941
not want you to,887474
the shape of the,887047
"of it , and",887038
the only one who,886868
I thought it was,886221
be taken into account,884876
I can not do,884264
than that of the,884226
"him , but he",883716
out to be a,883672
I was in the,882468
to focus on the,881619
get out of here,881586
in the nineteenth century,881399
is not to be,881337
to the edge of,881236
for a number of,880359
is a matter of,879646
I did not even,878986
went back to the,878973
at the sight of,878305
is the fact that,878177
do not even know,876190
two - thirds of,876178
"In contrast , the",876036
It does not matter,875875
middle of the night,875472
end of the day,875343
The New York Times,874829
the midst of the,874384
"of course , the",874204
the back of my,873459
"In fact , I",871229
by means of a,871157
similar to that of,871079
is shown in Fig,870337
the mouth of the,870261
that we do not,869989
That 's why I,867776
of this book may,867671
an example of a,867378
the strength of the,867335
as a consequence of,866532
a quote from the,866389
a small number of,866069
to the other side,865799
one - third of,865467
do not think that,865330
and she did not,863584
in front of them,863456
had a chance to,862258
either side of the,862142
it is not the,861050
information may be obtained,860919
to the right of,860688
the first time I,859662
that it was the,859635
twenty - four hours,859201
I want to know,858443
to say that the,858182
that he would not,857380
it will not be,856927
the performance of the,856536
It was not until,854694
on both sides of,854422
as long as you,854254
to be the most,854152
According to the news,854063
that she was not,853019
this book may be,852979
additional information may be,852952
that I could not,852865
did not mean to,851662
in line with the,851577
the interests of the,850496
he was about to,850259
be seen in the,850245
with the use of,850054
information on this research,849605
on the use of,849533
in contrast to the,849522
that it is the,849490
that additional information may,849486
"one hand , and",849479
on this research see,849427
report that additional information,849240
quote from the research,848623
obtained a quote from,848295
a change in the,847954
if and only if,847428
has to do with,847422
As a matter of,847198
Copyright 2010 Cengage Learning,846429
in the opposite direction,845557
was the one who,842651
at the hands of,841679
I 'll see you,840442
is equal to the,840392
side of the road,839031
is determined by the,838765
I do not mean,837307
so that you can,836636
this part of the,834853
have a lot of,834676
I went to the,833533
NJ : Princeton University,833106
it is to be,832825
within the context of,832385
I can tell you,832311
the application of the,832269
on the top of,832153
on the verge of,831735
was not the only,830987
but she could not,830922
due to the fact,830859
"However , there is",830234
the body of the,829513
the formation of the,828748
is based on a,827153
In the context of,826486
would have been a,826474
What 's going on,825891
an important part of,825761
do not think it,825280
to the side of,825008
on a regular basis,824685
the whole of the,824350
We do not know,824217
he or she is,824096
you will not be,824029
that some of the,823875
in light of the,823784
and long - term,823483
to do the same,823311
there was no way,822052
the New York Times,821984
in a series of,821798
over a period of,821730
this is not the,819126
they were going to,817421
in the fact that,816143
what it means to,815567
if there is a,814352
We do not have,814168
I can not say,814003
play an important role,814001
New York : Harper,812550
"for example , that",812144
a lot of people,812006
in a manner that,811941
while at the same,811812
to find out what,811613
take into account the,811585
I should not have,811343
New York : Columbia,811283
Why did not you,810727
at the thought of,810569
under the influence of,810235
if I do not,809897
but it does not,809064
is considered to be,808692
the success of the,807425
I 'm trying to,807268
to the conclusion that,806373
what to do with,806079
the weight of the,805756
first half of the,805340
I just do not,805082
that it does not,804655
did not know that,804318
looked at each other,804132
I thought you were,802854
"Press , New York",802724
of the use of,802190
from one of the,801622
as far as I,800717
Personality and Social Psychology,800317
by the use of,800270
to do with it,800103
it had not been,799616
