ngram,freq
c'est - à - dire,3579966
a - t - il,1552013
vis - à - vis,936414
demanda - t - il,831663
demanda - t - elle,667747
Qu'est - ce que tu,603447
a - t - elle,510048
c'est -- à -- dire,488436
il n'y a pas de,443964
à ce moment - là,417366
au - dessus de la,412071
au fur et à mesure,401314
des droits de l' homme,394490
ajouta - t - il,379314
Il n'y a pas de,374899
rez - de - chaussée,359640
murmura - t - il,357642
murmura - t - elle,352055
de l' autre côté de,342071
semble - t - il,333179
l' autre côté de la,332480
jeta un coup d' œil,327478
dans le cadre de la,304765
l' un de l' autre,279841
C'est - à - dire,271141
l' un et l' autre,256971
passe - t - il,254852
de part et d' autre,253227
ajouta - t - elle,246950
dans le cadre d' une,246622
Est - ce que tu,246581
un coup d' œil à,239425
sur - le - champ,235023
Qu'est - ce que vous,234802
Ouvert tous les jours de,233581
au - delà de la,232203
du lundi au vendredi de,231581
du lundi au samedi de,230364
d' un point de vue,226390
ce qu'il y a de,226129
l' un à l' autre,221221
de l' après - midi,217483
dans le domaine de la,213968
à la fin de la,213552
qu'est - ce que tu,210206
Qu'est - ce que c'est,208551
la mise en œuvre de,204943
à l' intérieur de la,199836
Ouvert du lundi au samedi,199294
de plus en plus de,199007
que je ne suis pas,198053
du point de vue de,192858
Que se passe - t,189726
la mise en place d',186235
Ouvert du lundi au vendredi,185947
Est - ce que je,185816
la mise en place de,185200
fur et à mesure que,179648
"et , d' autre part",177654
du mardi au samedi de,177079
t - il d' une,175978
à l' aide d' un,173775
Je ne sais pas si,171907
déclara - t - il,171622
ne serait - ce que,170335
va - t - il,168916
de l' autre côté du,164981
en ce qui concerne les,164811
s'écria - t - il,164701
dans le cadre de l',164499
à la fin de l',158510
dans le cadre d' un,158185
à 12h et de 14h,157259
est - ce que tu,156648
au - dessus de l',155374
à la fin des années,154409
tout au long de la,153613
lança - t - il,152042
sur la pointe des pieds,150380
demande - t - il,147668
fait l' objet d' une,147447
t - il d' un,147411
n'a rien à voir avec,146919
Je ne sais pas ce,145695
dans la salle de bains,144435
Il en est de même,144107
Qu'est - ce que je,144067
t - elle d' une,144021
point de vue de la,143973
à l' aide d' une,141780
Est - ce que vous,141166
la fin de l' année,140018
quatre - vingt - dix,139939
Ouvert du mardi au samedi,139906
dans la mesure où il,139823
va - et - vient,139176
s'écria - t - elle,138643
l' un ou l' autre,137857
par - dessus son épaule,136674
à l' égard de la,135620
de la Cour de cassation,134934
au samedi de 10h à,131658
fin d' après - midi,131628
qu'il n'y a pas de,131275
est de plus en plus,131083
répliqua - t - elle,130924
jeter un coup d' œil,130809
Retour au début du chapitre,130663
en ce qui concerne la,129820
répéta - t - il,129520
l' autre bout de la,129302
au - dessus de sa,128632
l' un ni l' autre,128151
sous la forme d' un,126884
cria - t - il,126852
est - ce que je,126838
pas eu le temps de,126234
Mais qu'est - ce que,126149
Emploi projeté au Canada en,125779
de ce que l' on,125692
le midi et le soir,125594
à la recherche d' un,125512
à l' origine de la,125420
lança - t - elle,125210
pensa - t - il,124921
s'exclama - t - elle,124506
l' un d' entre eux,124088
il n'y a pas d',123625
répliqua - t - il,122457
songea - t - elle,121208
a - t - on,121201
je ne l' ai pas,120605
la fin de la guerre,119823
de la tête aux pieds,119435
de la Seconde Guerre mondiale,119366
sont de plus en plus,119123
ce que je veux dire,118345
au - delà de l',118324
projeté au Canada en liaison,118232
ne sais pas ce que,117875
ce n'est pas le cas,117328
Que s'est - il passé,117314
De ce point de vue,116764
à la suite d' une,116643
C'est la raison pour laquelle,116180
la première fois que je,115778
a -- t -- il,115495
à l' autre bout de,115215
vis -- à -- vis,114872
le président de la République,114658
à l' autre bout du,114541
une manière ou d' une,114244
manière ou d' une autre,114222
Qu'est - ce qui se,114185
Qu'est - ce que ça,113635
déclara - t - elle,113575
à l' égard de l',113550
était sur le point de,113012
il n'y avait pas de,112974
dans le domaine de l',111870
mise en place d' un,111786
en liaison avec les marchandises,110698
dans la salle à manger,110638
européenne des droits de l',110412
qu'il y a de plus,110257
sous la forme d' une,110196
comme si de rien n'était,110166
Il en va de même,109392
dit - il d' une,109366
répéta - t - elle,109327
de la salle de bains,107518
"d' une part , et",107309
dans la mesure où elle,106514
à la suite de la,106462
l' un après l' autre,105865
t - il avec un,105839
l' une ou l' autre,105790
t - elle d' un,105644
à l' intérieur de l',105547
n'a - t - il,105228
t - il en se,105032
il y a quelques années,104450
s'exclama - t - il,103818
d' un signe de tête,103584
dans l' après - midi,103566
Au fur et à mesure,103488
à - vis de la,103266
du coin de l' œil,103217
faire l' objet d' une,103157
point de vue de l',102835
En ce qui concerne les,102747
fur et à mesure de,102609
Au bout d' un moment,102556
projeté au CANADA en liaison,102208
au CANADA en liaison avec,102131
Emploi projeté au CANADA en,102130
tout au long de l',101989
à - vis de l',101945
expliqua - t - il,101681
CANADA en liaison avec les,101659
Il n'y a pas d',101521
les uns et les autres,101428
d' une manière ou d',101049
droits de l' homme et,100679
ce qui se passe dans,100668
À ce moment - là,100346
Qu'est - ce qu'il y,99901
Table des matières du titre,99762
songea - t - il,99745
ce que l' on appelle,99589
des uns et des autres,99244
la mise en œuvre des,99202
pensa - t - elle,99026
n'est peut - être pas,99000
à l' occasion de la,98795
pour la première fois depuis,98583
de la mise en œuvre,98437
mise en œuvre de la,98051
et de 14h à 18h,98033
ce que l ' on,97849
part et d' autre de,97695
des hommes et des femmes,97421
m'a - t - il,97390
à l' entrée de la,97192
l' un contre l' autre,97073
Retour à la liste des,96989
la fin du XIX e,96531
demande - t - elle,96496
A - t - il,96339
Il ne s'agit pas de,96220
de ce point de vue,95113
des titres Table des matières,95082
peut - être un peu,94506
ni l' un ni l',94187
à ce que l' on,93500
l' une de l' autre,93473
au vendredi de 9h à,93265
Liste des titres Table des,93005
la porte de la chambre,92669
les hommes et les femmes,92289
D' un point de vue,92057
fin du XIX e siècle,91937
pour la première fois de,91920
la tombée de la nuit,91845
t - elle en se,91634
À voir -- À faire,91108
les uns après les autres,90824
au samedi de 9h à,90768
de 9h à 12h et,90557
à la recherche d' une,90499
l' une et l' autre,90449
à la suite d' un,90307
les jours de 10h à,90262
l' un pour l' autre,89727
droits de l ' homme,89442
annonça - t - il,89104
à partir du moment où,89014
cria - t - elle,88894
Je ne l' ai pas,87768
mise en place d' une,87294
en ce qui concerne le,87177
ajoute - t - il,86822
Il n'y avait pas de,86445
tous les jours de 10h,86340
de ce qui se passe,86262
ce qui ne va pas,86195
sur le bord de la,86100
de commerce n'est pas accordé,85947
"Non , ce n'est pas",85516
qu'est - ce que vous,85284
ce que tu as fait,85092
fait l' objet d' un,85051
un bout à l' autre,84970
est à l' origine de,84957
Je ne sais pas comment,84569
pas grand - chose à,84515
la plus grande partie de,84394
de la part de l',84186
et de 14h à 19h,84059
leva les yeux au ciel,83825
à l' ordre du jour,83196
un geste de la main,83183
dit - elle d' une,83088
tout ce qu'il y a,82894
tête - à - tête,82789
titres Table des matières du,82665
Je ne crois pas que,82611
arc - en - ciel,81800
"lui - même , il",81691
dit - il d' un,81472
eau - de - vie,81466
début du XX e siècle,81188
du mardi au vendredi de,81015
à la mise en œuvre,80709
une façon ou d' une,80475
façon ou d' une autre,80454
t - elle avec un,80307
qu'est - ce que je,79870
pour la première fois en,79798
jette un coup d' œil,79757
gaz à effet de serre,79705
Qu'est - ce qui vous,79642
d' un bout à l',79620
à droite et à gauche,79344
l' une à l' autre,79194
Toujours est - il que,79130
il n'y a plus de,79099
je ne sais pas si,78967
de l' histoire de la,78912
à l' intérieur d' un,78902
de l ' autre côté,78886
continua - t - il,78788
à la mise en place,78427
Est - ce que ça,78321
à la porte de la,78096
d' autre choix que de,77812
du président de la République,77645
Pourquoi est - ce que,77645
le pas de la porte,77497
d' un certain nombre de,77364
Aix - en - Provence,77189
dans la mesure où les,77135
que je ne peux pas,76957
sur le marché du travail,76811
la question de savoir si,76719
ordonna - t - il,76566
Je ne sais pas pourquoi,76221
dans le sens de la,76048
"lui - même , et",76011
un jour ou l' autre,75964
il y a plus de,75712
Il y a quelque chose,75712
et se dirigea vers la,75580
de quoi que ce soit,75469
Je ne veux pas que,75407
la fin de sa vie,75402
Pour la première fois depuis,75268
la tête d' un air,75192
saison : tous les jours,75074
comme nous l' avons vu,75030
la fin du XIXe siècle,74983
sur le champ de bataille,74867
Code de la propriété intellectuelle,74724
de la salle à manger,74541
dans la plupart des cas,74432
mais je ne suis pas,74066
au bout d' un moment,73892
au - dessus de lui,73811
En ce qui concerne la,73659
À la fin de la,73177
devient de plus en plus,73167
lundi au vendredi de 9h,73104
marmonna - t - il,72998
à 12h30 et de 14h,72962
de la main - d'œuvre,72870
en est de même pour,72712
de plus en plus souvent,72634
expliqua - t - elle,72554
Service / Représentant pour Signification,72513
ce que ça veut dire,72444
en ce qui concerne l',72405
les droits de l' homme,72396
de la même manière que,72170
se fait - il que,72091
de l' histoire de l',72014
Je ne pense pas que,71782
Qu'est - ce que cela,71672
un coup d ' œil,71626
d' une demi - heure,71544
va - t - elle,71513
chuchota - t - elle,71464
la première fois de sa,71462
les uns contre les autres,71308
de 10h à 12h et,71301
de la vie et de,71213
est - ce que vous,71183
dans un coin de la,71152
de plus en plus à,71021
serait - ce que pour,70957
je suis en train de,70919
n'est pas tout à fait,70871
"peut - être , mais",70844
que l' on ne peut,70671
de la manière la plus,70496
se dirigea vers la porte,70398
au bord de l' eau,70348
sera - t - il,69837
de la prise en charge,69824
de la mise en place,69808
n'avait rien à voir avec,69751
"En tout cas , il",69612
ce que l' on peut,69407
Cour européenne des droits de,69398
reste - t - il,69334
Pour ce qui est de,69125
C'est la première fois que,68998
à l ' égard de,68952
d' une façon ou d',68942
que l ' on peut,68919
connu sous le nom de,68901
Je ne suis pas un,68833
en vigueur le 1 er,68826
à la manière d' un,68822
dans la mesure où la,68725
Avec un peu de chance,68683
Que voulez - vous dire,68551
je ne sais pas ce,68531
des matières Retour à la,68470
matières Retour à la liste,68465
en va de même pour,68461
Ce n'est pas ce que,68448
à la tête de la,68442
for Service / Représentant pour,68393
à l ' intérieur de,68362
Haute saison : tous les,68257
commença - t - il,68256
de la Première Guerre mondiale,68240
la mise en œuvre d',68199
il ne s'agit pas de,68176
au coin de la rue,68138
la prise en compte de,68136
insista - t - il,68125
dit - il en se,67956
chuchota - t - il,67947
n'eut pas le temps de,67910
première fois de sa vie,67864
en même temps que le,67791
dans le cas de la,67737
de la porte d' entrée,67658
de la part de la,67547
pour ce qui est de,67539
sur le plan de la,67467
Qu'est - ce que la,67417
l ' après -- midi,67340
sous l' effet de la,67287
la mise en œuvre du,67166
Enregistrement auprès du Secrétariat des,67068
dans la mesure où le,66828
les jours de 9h à,66812
"Dans ce cas , il",66793
pour la première fois dans,66719
"Pour ma part , je",66430
un coup d' œil sur,66427
je me suis dit que,66305
au milieu de la nuit,66272
en même temps que la,66082
Qu'est - ce qui te,65994
L' espace d' un instant,65861
au long de l' année,65815
des droits de l' Homme,65751
qu'est - ce que c'est,65681
à la liste des titres,65476
et de plus en plus,65396
de l' un à l',65265
"De toute façon , il",65230
"et , le cas échéant",65204
ne sais pas ce qui,65104
Et qu'est - ce que,65053
bien au - delà de,64987
Comment se fait - il,64978
faire l' objet d' un,64609
ce que je viens de,64548
rétorqua - t - elle,64533
En tout état de cause,64155
ce que tu veux dire,64018
la table de la cuisine,63948
ce ne sont pas les,63934
à la suite de l',63919
de la même façon que,63907
de son grand - père,63906
entre - deux - guerres,63903
ce moment - là que,63880
à l' arrière de la,63748
souffla - t - elle,63725
de la façon la plus,63701
Au - delà de la,63594
de sa grand - mère,63519
à l' intérieur d' une,63369
"dit - il , je",63295
de l' homme et de,63228
information et de la communication,63223
lundi au samedi de 10h,63112
tous les jours de 9h,63099
l' impôt sur le revenu,63085
sur le seuil de la,63039
dans l' histoire de la,62621
la prit dans ses bras,62578
autre côté de la rue,62534
Île - de - France,62530
mardi au samedi de 10h,62405
rien à voir avec la,62349
de l' information et de,62280
je ne crois pas que,62096
est en train de se,62075
Representative for Service / Représentant,62032
à l' occasion d' une,62018
ne veut pas dire que,61965
de la part d' un,61934
Il n'y a rien de,61847
du mardi au dimanche de,61700
t - il à l',61553
sur le pas de la,61439
De l' autre côté de,61036
en application de l' article,60971
mais je ne peux pas,60817
je ne me suis pas,60806
dans la mesure où l',60637
le samedi de 10h à,60573
"De toute façon , je",60518
le vendredi et le samedi,60499
de l ' Union européenne,60433
et suivants du Code de,60377
et les jours fériés de,60362
souffla - t - il,60361
ce que l' on a,60339
l' une après l' autre,60276
C'est pour cette raison que,60241
Que veux - tu dire,60231
Il ne s'agit pas d',60191
un signe de la main,60137
au - delà de ce,60084
la mort de son père,59902
au - dessus d' un,59874
du Conseil de l' Europe,59838
la prise en charge des,59732
et peut - être même,59715
de plus en plus nombreux,59699
de ce qui s'est passé,59537
Est - ce que c'est,59520
par le biais de la,59477
de plus en plus fort,59346
la mise en place des,59324
au - dessus d' elle,59256
à l' origine de l',59201
de plus en plus d',59121
Je n'ai pas besoin de,59116
du point de vue des,59071
lundi au samedi de 9h,59032
des pieds à la tête,58987
depuis au moins aussi tôt,58929
d' un hochement de tête,58682
au sens de l' article,58569
"Peut - être , mais",58569
comme on l' a vu,58544
devenait de plus en plus,58541
Il jeta un coup d',58313
d' hommes et de femmes,58290
à l' occasion d' un,58271
m'a - t - elle,58226
ce n'était pas le cas,58149
ce qui est de la,58093
était en train de se,58039
les unes que les autres,58035
tout à l ' heure,58021
l' autre côté de l',57990
ne sais pas si je,57852
l' un des plus grands,57770
face - à - face,57522
En ce qui concerne le,57516
l' information et de la,57497
veux - tu que je,57449
en même temps que les,57408
dit - il avec un,57400
les uns que les autres,57356
au cours de l' année,57298
au bord de la mer,57251
au vendredi de 10h à,57247
de ce côté - là,57122
Basse saison : ouvert du,57057
ce que vous avez fait,57051
les uns sur les autres,57017
à la tête de l',57013
n'était peut - être pas,56992
à la tête d' une,56846
vie de tous les jours,56842
à l' occasion de l',56831
jetant un coup d' œil,56813
de gaz à effet de,56715
l' une contre l' autre,56569
le samedi de 9h à,56427
que ce ne soit pas,56421
n'en reste pas moins que,56419
demi - heure plus tard,56303
il y a quelque chose,56160
"et , en même temps",56077
à mi - chemin entre,56053
Pas - de - Calais,56041
l' une d' entre elles,56006
ce que je peux faire,55937
annonça - t - elle,55870
le point de départ de,55866
ne veux pas que tu,55841
a fait l' objet d',55693
coup d' œil à la,55669
les États - Unis et,55661
que nous ne sommes pas,55639
Ouvert du mardi au dimanche,55603
dans le cas d' une,55544
rétorqua - t - il,55504
pas le moins du monde,55489
De Verset : 01 02,55444
Indice De Verset : 01,55444
Verset : 01 02 03,55395
insista - t - elle,55379
de ce qui se passait,55181
je ne pense pas que,55166
quelque procédé que ce soit,55149
par quelque procédé que ce,55113
aux États - Unis et,55100
e e e e e,55066
rien à voir avec le,55015
que dans la mesure où,54845
il n'y a rien de,54798
je ne suis pas un,54710
je vous l' ai dit,54661
la plupart d' entre eux,54636
qu'est - ce que ça,54632
ce qu'il y avait de,54553
Chambre double à partir de,54550
dit - elle en se,54546
à l' aide de la,54498
Je ne savais pas que,54473
est sur le point de,54473
la Cour européenne des droits,54434
"Quant à moi , je",54368
dans la mesure du possible,54353
le devant de la scène,54337
à qui que ce soit,54324
à la fin du mois,54319
dit - elle d' un,54146
à l' extérieur de la,54117
moins que ce ne soit,54083
lâcha - t - il,53934
un coup d' œil par,53871
que je ne sais pas,53862
Ouvert du mardi au vendredi,53840
début d' après - midi,53568
que je ne veux pas,53547
dans la seconde moitié du,53496
la porte de la salle,53468
une grande partie de la,53448
du point de vue du,53415
le point de vue de,53326
ne s'agit pas d' une,53289
le chef de l' État,53268
je ne veux pas que,53245
au - dessus de son,53219
que se passe - t,53206
il y a deux ans,53174
"Dans ce cas , le",53122
je ne l' ai jamais,53111
de près ou de loin,52899
au même titre que les,52865
la fin de la journée,52465
à l' époque de la,52460
Je n'ai pas envie de,52408
de tout ou partie de,52399
protesta - t - elle,52357
la Bibliothèque nationale de France,52308
suivants du Code de la,52239
dans le champ de la,52204
la quasi - totalité des,52188
"t - il , en",52178
l' espace d' un instant,52074
un coup d' œil dans,51918
le bien et le mal,51893
au sein de la société,51881
la prise en compte des,51879
"Cambridge , Cambridge University Press",51845
"dit - il , et",51809
de plus en plus vite,51800
une demi - douzaine de,51783
Convention européenne des droits de,51582
à l' origine d' une,51485
samedi de 10h à 19h,51482
t - il en lui,51435
dans le contexte de la,51338
dans la mesure où ils,51186
je ne sais pas comment,51179
dans l' histoire de l',51150
à l' un de ses,51121
les membres de la famille,51064
du Code de procédure pénale,51031
si l' on peut dire,51029
Asie du Sud - Est,51029
la surface de l' eau,51028
la vie et la mort,50899
la protection de l' environnement,50877
je n'ai pas envie de,50836
donner un coup de main,50827
et d' autre de la,50767
Pour la première fois de,50745
"Et puis , il y",50708
Je lui ai dit que,50672
au samedi de 9h30 à,50530
Ce n'est pas parce que,50464
connue sous le nom de,50458
à la recherche de la,50424
la mise en place du,50399
"En tout cas , je",50391
je me suis rendu compte,50387
dans le sens d' une,50358
au beau milieu de la,50319
en chair et en os,50296
y accéder et en partir,50216
la fin du mois de,50200
Comment y accéder et en,50110
C'était la première fois que,50099
à la fin du XIX,50093
Employée au Canada depuis au,50075
le procureur de la République,50036
sur le point de se,49983
l ' histoire de la,49976
la prise en charge de,49912
un coup d' œil au,49865
que je ne connais pas,49770
A - t - elle,49754
qu'il n'y avait pas de,49536
il ne s'agit pas d',49511
"Rousseau , Jean -- Jacques",49511
soupira - t - elle,49487
hurla - t - il,49480
pas de temps à perdre,49462
de la Légion d' honneur,49455
se leva d' un bond,49419
les unes après les autres,49396
Mais je ne suis pas,49277
de l' après - guerre,49276
sur la base d' un,49209
les mains dans les poches,49186
qui n'est pas le cas,49140
Existe - t - il,49122
"et , de l' autre",49082
de la Grande - Bretagne,49068
t - il avant de,48996
n'ai pas l' intention de,48972
il n'y en a pas,48839
"Zola , Emile Copyright Arvensa",48781
Emile Copyright Arvensa Editions Page,48781
la Cour de cassation a,48771
Table des matières Retour à,48739
une bonne partie de la,48723
en ce temps - là,48698
la vie et de la,48674
Qu'est - ce que le,48647
au bord de la route,48643
y a quelque chose de,48643
d' un grand nombre de,48606
de la nature et de,48602
un peu à l' écart,48548
était de plus en plus,48537
Je me suis dit que,48512
Jacques Copyright Arvensa Editions Page,48399
que je ne pouvais pas,48375
Jean -- Jacques Copyright Arvensa,48328
qui est en train de,48297
en un clin d' œil,48282
Il n'y a plus de,48247
et je ne suis pas,48198
à l ' aide de,48105
de dix - huit ans,48059
murmure - t - il,48028
ce qui est arrivé à,48000
pas la première fois que,47977
une bonne fois pour toutes,47926
Je ne l' ai jamais,47864
à la veille de la,47851
chef d' état - major,47802
en vertu de l' article,47792
sur la base d' une,47776
"Dans ce cas , je",47733
la porte de sa chambre,47684
qu'il était en train de,47681
pas la moindre idée de,47681
à l ' origine de,47646
que je suis en train,47608
"t - il , et",47599
ne s'agit pas d' un,47568
voulez - vous que je,47560
Ouvert toute l ' année,47514
tout ce que l' on,47494
ce ne sont pas des,47451
de ma grand - mère,47442
à l' écart de la,47430
à - dire de la,47426
n'a - t - elle,47378
"En même temps , il",47338
explique - t - il,47336
d' un geste de la,47330
Il y a beaucoup de,47323
de faire en sorte que,47285
juste au - dessus de,47258
de 10h à 12h30 et,47239
au -- dessus de la,47222
n'est pas ce que je,47204
commença - t - elle,47191
samedi de 9h à 12h,47186
Mais qu'est - ce qui,47185
le Président de la République,47171
mais je ne sais pas,47133
tout au long de sa,47107
depuis le début de la,47076
et je ne veux pas,47040
faire quoi que ce soit,47002
n'était pas la première fois,46996
et il n'y a pas,46889
au - dessus de moi,46889
"Paris , Gallimard , coll",46888
du bien et du mal,46885
"Dans ce cas , la",46855
il n'y a rien à,46842
Il y eut un silence,46815
du Code de la propriété,46776
coup d' œil à l',46728
Il n'en reste pas moins,46727
que je ne voulais pas,46613
dit - il en lui,46599
est l' un des plus,46585
la fin des années 1990,46546
n'ai pas le temps de,46439
Du point de vue de,46437
à l ' égard des,46383
de plus en plus difficile,46382
au cours de la période,46367
à peine le temps de,46337
la fin des années 1980,46288
haut - le - cœur,46256
dans le cas d' un,46236
dans la poche de son,46117
dans la mise en œuvre,46098
samedi le midi et le,46093
n'en demeure pas moins que,46084
Elle jeta un coup d',46056
y a des gens qui,46004
ce qui se passait dans,45946
"elle - même , elle",45925
prise en compte de la,45888
marmonna - t - elle,45863
"Alors , qu'est - ce",45779
jusqu'à la fin de la,45756
que je ne connaissais pas,45738
au - dessus d' une,45694
pour la première fois à,45629
un moment ou à un,45532
à la hauteur de la,45512
la prendre dans ses bras,45510
moment ou à un autre,45475
l' un sur l' autre,45466
jeté un coup d' œil,45439
à la fin de sa,45414
Du coin de l' œil,45408
il d' une voix rauque,45220
"D' autre part , la",45203
en bonne et due forme,45179
avoua - t - elle,45167
je ne l' avais pas,45151
au long de la vie,45137
comme ce fut le cas,45102
à soupe d' huile d',45101
ce qui venait de se,45057
continua - t - elle,45039
se rendre à l' évidence,45037
ce qui n'est pas le,44931
précisa - t - il,44878
la vie de tous les,44873
au greffe du tribunal de,44858
je me rends compte que,44815
que je ne l' ai,44810
"la première fois , il",44807
pense - t - il,44806
et les États - Unis,44800
en tout état de cause,44732
à l ' aide d,44730
Il est à noter que,44723
dit - elle avec un,44693
dira - t - on,44668
de l' ensemble de la,44647
Je ne suis pas sûr,44612
Je ne sais même pas,44603
qui est à l' origine,44588
de l' homme et du,44581
de la cour d' appel,44522
soupira - t - il,44504
de l' ordre de la,44497
il y a peu de,44489
de la fin des années,44363
de l' un de ses,44286
à la fois de la,44147
À la fin de l',44115
des années quatre - vingt,44091
est de l' ordre de,44050
avant la fin de la,44005
dans le cas de l',44002
quelques - uns de ses,43969
un coup d' œil vers,43960
il ne faut pas oublier,43895
d' un quart d' heure,43860
C'est pour ça que je,43854
"lui - même , mais",43837
il y a quelques jours,43815
un peu de temps pour,43812
"D' autre part , il",43810
dans la salle d' attente,43774
ne se limite pas à,43767
avant de se tourner vers,43751
à la recette des finances,43710
Et puis il y a,43701
Qu'est - ce qui ne,43656
Qu'est - ce qui s'est,43640
"Non , pas du tout",43640
dans l' au - delà,43580
n'avait pas l' intention de,43541
y a peut - être,43513
à deux pas de la,43497
la liberté de la presse,43493
au point de vue de,43417
de mon grand - père,43305
de façon à ce que,43265
de l' au - delà,43183
les battements de son cœur,43177
il n'en reste pas moins,43168
Comme nous l' avons vu,43153
la fin des années 1970,43147
sur le ton de la,43143
à l' image de la,43138
la fin du Moyen Âge,43098
l' encadrement de la porte,43079
Il n'y a rien à,43029
Notre - Dame - de,42991
l' un des plus beaux,42966
n'est pas la première fois,42962
l' autre bout du fil,42932
la Convention européenne des droits,42922
à la base de la,42878
si l' on en croit,42867
n'y a pas d' autre,42822
au milieu de la pièce,42816
soupe d' huile d' olive,42767
ouvert tous les jours de,42753
"d' une part , les",42736
"qu'il en soit , il",42713
l ' autre côté de,42698
il y a beaucoup de,42690
Ne me dis pas que,42683
sur la base de la,42651
sur le fondement de l',42645
mise en œuvre d' une,42641
sur le devant de la,42617
le long de la route,42614
de la seconde moitié du,42567
"que je sais , c'est",42505
force est de constater que,42499
"moi , dit - il",42485
Ce ne sont pas des,42464
Transports Comment y accéder et,42410
ce qui se passe en,42406
Tout se passe comme si,42388
de mettre un terme à,42380
"d' une part , la",42376
