ngram,freq
affirma - t - il,42366
sur le chemin de la,42356
au samedi le midi et,42350
l' entrée en vigueur de,42340
mise en place de la,42337
les uns avec les autres,42315
au - dessus d' eux,42279
Je n'ai pas le temps,42267
à l' encontre de la,42257
n'a pas le droit de,42246
dans le monde de la,42241
lui laisser le temps de,42218
"de la ville , et",42206
du temps et de l',42144
De quoi s'agit - il,42066
Il y avait quelque chose,42040
au - dessus de ses,42027
la raison pour laquelle il,41982
"elle - même , et",41982
l' histoire de l' humanité,41950
"D' autre part , les",41949
le lundi de 14h à,41918
"Le problème , c'est que",41913
au - dessus de ma,41902
liaison avec les marchandises mentionnées,41900
la première fois de ma,41816
Au bout de quelques minutes,41798
Je crois que je vais,41774
par le biais d' une,41734
ce que tu fais là,41719
lance - t - il,41701
le plus grand nombre de,41680
avec les marchandises mentionnées sous,41675
me suis rendu compte que,41668
à la lumière de la,41647
dans la salle de bain,41592
dans la plupart des pays,41516
les forces de l' ordre,41469
ont été déposés au greffe,41445
sur le chemin du retour,41411
de manière à ce que,41366
